Mussum ipsum cacilds, vidis litro abertis.
Consetis adipiscings elitis. Pra lá , depois divoltis porris, paradis.
Paisis, filhis, espiritis santis.
Mé faiz elementum girarzis, nisi eros vermeio, in elementis mé pra quem é amistosis quis leo.
Manduma pindureta quium dia nois paga.
Sapien in monti palavris qui num significa nadis i pareci latim.
Interessantiss quisso pudia ce receita de bolis, mais bolis eu num gostis.
Suco de cevadiss, é um leite divinis, qui tem lupuliz, matis, aguis e fermentis.
rrent Quick Style Set command.
Both the Themes gallery and the Quick Styles gallery provide reset commands so that you can always restore the look of your document to the original contained in your current template.
On the Insert tab, the galleries include items that are designed to coordinate with the overall look of your document.
You can use these galleries to insert tables, headers, footers, lists, cover pages, and other document building blocks.
Both the Themes gallery and the Quick Styles gallery provide reset commands so that you can always restore the look of your document to the original contained in your current template.
On the Insert tab, the galleries include items that are designed to coordinate with the overall look of your document.
You can use these galleries to insert tables, headers, footers, lists, cover pages, and other document building blocks.
When you create pictures, charts, or diagrams, they also coordinate with your current document look.
You can easily change the formatting of selected text in the document text by choosing a look for the selected text from the Quick Styles gallery on the Home tab.
You can also format text directly by using the other controls on the Home tab.
Most controls offer a choice of using the look from the current theme or using a format that you specify directly.
To change the overall look of your document, choose new Theme elements on the Page Layout tab.
To change the looks available in the Quick Style gallery, use the Change Current Quick Style Set command.
Both the Themes gallery and the Quick Styles gallery provide reset commands so that you can always restore the look of your document to the original contained in your current template.
On the Insert tab, the galleries include items that are designed to coordinate with the overall look of your document.
You can use these galleries to insert tables, headers, footers, lists, cover pages, and other document building blocks.
When you create pictures, charts, or diagrams, they also coordinate with your current document look.
You can easily change the formatting of selected text in the document text by choosing a look for the selected text from the Quick Styles gallery on the Home tab.
You can also format text directly by using the other controls on the Home tab.
Most controls offer a choice of using the look from the current theme or using a format that you specify directly.
To change the overall look of your document, choose new Theme elements on the Page Layout tab.
To change the looks available in the Quick Style gallery, use the Change Current Quick Style Set command.
Both the Themes gallery and the Quick Styles gallery provide reset commands so that you can always restore the look of your document to the original contained in your current template.
On the Insert tab, the galleries include items that are designed to coordinate with the overall look of your document.
You can use these galleries to insert tables, headers, footers, lists, cover pages, and other document building blocks.
When you create pictures, charts, or diagrams, they also coordinate with your current document look.
You can easily change the formatting of selected text in the document text by choosing a look for the selected text from the Quick Styles gallery on the Home tab.
You can also format text directly by using the other controls on the Home tab.
Most controls offer a choice of using the look from the current theme or using a format that you specify directly.
To change the overall look of your document, choose new Theme elements on the Page Layout tab.
To change the looks available in the Quick Style gallery, use the Change Current Quick Style Set command.
Both the Themes gallery and the Quick Styles gallery provide reset commands so that you can always restore the look of your document to the original contained in your current template.
On the Insert tab, the galleries include items that are designed to coordinate with the overall look of your document.
You can use these galleries to insert tables, headers, footers, lists, cover pages, and other document building blocks.
When you create pictures, charts, or diagrams, they also coordinate with your current document look.
You can easily change the formatting of selected text in the document text by choosing a look for the selected text from the Quick Styles gallery on the Home tab.
You can also format text directly by using the other controls on the Home tab.
Most controls offer a choice of using the look from the current theme or using a format that you specify directly.
To change the overall look of your document, choose new Theme elements on the Page Layout tab.
Maecenas porttitor congue massa.
Fusce posuere, magna sed pulvinar ultricies, purus lectus malesuada libero, sit amet commodo magna eros quis urna.
Nunc viverra imperdiet enim.
Fusce est.
Vivamus a tellus.
Pellentesque habitant morbi tristique senectus et netus et malesuada fames ac turpis egestas.
Proin pharetra nonummy pede.
Mauris et orci.
Aenean nec lorem.
In porttitor.
Donec laoreet nonummy augue.
Suspendisse dui purus, scelerisque at, vulputate vitae, pretium mattis, nunc.
Mauris eget neque at sem venenatis eleifend.
Ut nonummy.
Fusce aliquet pede non pede.
Suspendisse dapibus lorem pellentesque magna.
Integer nulla.
Donec blandit feugiat ligula.
Integer ultrices lobortis eros.
Pellentesque habitant morbi tristique senectus et netus et malesuada fames ac turpis egestas.
Proin semper, ante vitae sollicitudin posuere, metus quam iaculis nibh, vitae scelerisque nunc massa eget pede.
Sed velit urna, interdum vel, ultricies vel, faucibus at, quam.
Donec elit est, consectetuer eget, consequat quis, tempus quis, wisi.
In in nunc.
Class aptent taciti sociosqu ad litora torquent per conubia nostra, per inceptos hymenaeos.
Donec ullamcorper fringilla eros.
Fusce in sapien eu purus dapibus commodo.
Cum sociis natoque penatibus et magnis dis parturient montes, nascetur ridiculus mus.
Cras faucibus condimentum odio.
Sed ac ligula.
Aliquam at eros.
Etiam at ligula et tellus ullamcorper ultrices.
In fermentum, lorem non cursus porttitor, diam urna accumsan lacus, sed interdum wisi nibh nec nisl.
Ut tincidunt volutpat urna.
Duis a quam non neque lobortis malesuada.
Praesent euismod.
Donec nulla augue, venenatis scelerisque, dapibus a, consequat at, leo.
Pellentesque libero lectus, tristique ac, consectetuer sit amet, imperdiet ut, justo.
Sed aliquam odio vitae tortor.
Proin hendrerit tempus arcu.
In hac habitasse platea dictumst.
Suspendisse potenti.
Vivamus vitae massa adipiscing est lacinia sodales.
Pellentesque cursus sagittis felis.
Pellentesque porttitor, velit lacinia egestas auctor, diam eros tempus arcu, nec vulputate augue magna vel risus.
Cras non magna vel ante adipiscing rhoncus.
Vivamus a mi.
Morbi neque.
Aliquam erat volutpat.
Integer ultrices lobortis eros.
Pellentesque habitant morbi tristique senectus et netus et malesuada fames ac turpis egestas.
Proin semper, ante vitae sollicitudin posuere, metus quam iaculis nibh, vitae scelerisque nunc massa eget pede.